{
  "actual_backend": null,
  "algorithm": "ip-kont",
  "artifacts": [
    {
      "media_type": "application/json",
      "path": "execution/skip_reason.json",
      "sha256": "4f5c8484048cb4169f411a2d2fcce52934f92524882308c4a295030c5c241174",
      "size_bytes": 152
    },
    {
      "media_type": "text/plain",
      "path": "execution/stderr.log",
      "sha256": "fc9a0c6b693ba7a9003881f89e0f040a04d366a4b5561ddcbe441d999f65deab",
      "size_bytes": 70
    },
    {
      "media_type": "text/plain",
      "path": "execution/stdout.log",
      "sha256": "e3b0c44298fc1c149afbf4c8996fb92427ae41e4649b934ca495991b7852b855",
      "size_bytes": 0
    },
    {
      "media_type": "application/json",
      "path": "input/instance.json",
      "sha256": "93e4a763b9ec21867e20f0c0c9880449e301c77823383f79a0566fa86a694c35",
      "size_bytes": 8294
    },
    {
      "media_type": "application/json",
      "path": "input_ref.json",
      "sha256": "011dd7db9eae344350b3c30ce21a415de292a52e9505c03717a6a533e59e4e60",
      "size_bytes": 522
    },
    {
      "media_type": "application/json",
      "path": "request.json",
      "sha256": "dbf99101e86e6043e38cf260c17922e5fcc6c063f96d012acbbe8cf47c5af450",
      "size_bytes": 1766
    },
    {
      "media_type": "application/json",
      "path": "result/result.json",
      "sha256": "999ac7be86c6772a0f7eb885803ba7c195e0d2f64ce7dc0fad45d879f1123e78",
      "size_bytes": 516
    },
    {
      "media_type": "application/json",
      "path": "verification/verification.json",
      "sha256": "9fb54d4890b33442b534f0c08b4e7b8b92c7bc597ee94531a26fa755b3c1dd5d",
      "size_bytes": 536
    }
  ],
  "backend_details": {
    "backend_detection": {
      "actual": "branch-and-bound",
      "requested": "auto",
      "selected": "branch-and-bound"
    },
    "backend_version": "unknown",
    "capabilities": {},
    "native": false
  },
  "configuration_sha256": "c9a05af4ed0f9e25f167192f764407067f494d55ef883778ea4f73534b3854b2",
  "experiment_id": "kdc-smoke20-all-registered-final-20261012T074200",
  "family": "st70",
  "finished_at": "2026-10-12T04:29:27.177522Z",
  "input_sha256": "93e4a763b9ec21867e20f0c0c9880449e301c77823383f79a0566fa86a694c35",
  "instance_id": "st70-fa79167d4566-93e4a763b9",
  "m": 25,
  "n": 22,
  "objective": "minmax",
  "provenance": {
    "platform": "macOS-27.2-arm64-arm-64bit",
    "solver_version": "unknown",
    "source_commit": null
  },
  "repeat": 0,
  "requested_backend": "auto",
  "rerun_of": "run_20261012T042129Z__ip-kont__minmax__st70-fa79167d4566-93e4a763b9__r00__2533e4d12bbe",
  "resolved_configuration": {
    "actual_threads": 1,
    "actual_time_limit_sec": 10.0,
    "algorithm_category": "exact_candidate",
    "backend_capabilities": {},
    "backend_detection": {
      "actual": "branch-and-bound",
      "requested": "auto",
      "selected": "branch-and-bound"
    },
    "benchmark_profile": "DEBUG",
    "brute_force_max_assignments": 100000,
    "brute_force_time_limit_sec": 0.5,
    "dataset_profile": "smoke20",
    "diagnostic_max_assignments": null,
    "exact_time_limit_sec": 10.0,
    "execution_disposition": {
      "message": "ip-kont is registered but the native KONT/COPT backend is unavailable",
      "reason_code": "BACKEND_UNAVAILABLE",
      "status": "SKIPPED"
    },
    "experiment_label": "smoke / development validation",
    "fast_time_limit_sec": 5.0,
    "minmax_budget_fraction": 0.5,
    "minsum_budget_fraction": 0.5,
    "minsum_refinement_policy": "adaptive",
    "per_static_time_limit_sec": 2.0,
    "reference_designated": false,
    "requested_algorithm": "ip-kont",
    "requested_backend": "auto",
    "requested_threads": 2,
    "requested_time_limit_sec": 10.0,
    "resolved_algorithm": "ip-kont",
    "selected_backend": "branch-and-bound"
  },
  "result": {
    "error_message": "{\"message\": \"ip-kont is registered but the native KONT/COPT backend is unavailable\", \"reason_code\": \"BACKEND_UNAVAILABLE\", \"status\": \"SKIPPED\"}",
    "feasible": false,
    "lower_bound": null,
    "objective_value": null,
    "optimality_status": "FAILED",
    "solver_result": {},
    "upper_bound": null
  },
  "run_id": "run_20261012T042927Z__ip-kont__minmax__st70-fa79167d4566-93e4a763b9__r00__a2d325e4eda8",
  "run_key": "7cfc03985c41fd7e4a9374ea0adf9aa601cc1188277c9dbf168248005b33086a",
  "schema_version": 1,
  "seed": 42,
  "selected_backend": "branch-and-bound",
  "started_at": "2026-10-12T04:29:27.172676Z",
  "status": "SKIPPED",
  "verification": {
    "checked_at": "2026-10-12T04:29:27.175042Z",
    "continuous": false,
    "experiment_id": "kdc-smoke20-all-registered-final-20261012T074200",
    "kind": "NONE",
    "message": "ip-kont is registered but the native KONT/COPT backend is unavailable",
    "passed": false,
    "result_sha256": "999ac7be86c6772a0f7eb885803ba7c195e0d2f64ce7dc0fad45d879f1123e78",
    "run_id": "run_20261012T042927Z__ip-kont__minmax__st70-fa79167d4566-93e4a763b9__r00__a2d325e4eda8",
    "schema_version": 1,
    "status": "NOT_RUN",
    "verification_mode": "not-run"
  }
}
