{
  "actual_backend": null,
  "algorithm": "ip-kont",
  "artifacts": [
    {
      "media_type": "application/json",
      "path": "execution/skip_reason.json",
      "sha256": "4f5c8484048cb4169f411a2d2fcce52934f92524882308c4a295030c5c241174",
      "size_bytes": 152
    },
    {
      "media_type": "text/plain",
      "path": "execution/stderr.log",
      "sha256": "fc9a0c6b693ba7a9003881f89e0f040a04d366a4b5561ddcbe441d999f65deab",
      "size_bytes": 70
    },
    {
      "media_type": "text/plain",
      "path": "execution/stdout.log",
      "sha256": "e3b0c44298fc1c149afbf4c8996fb92427ae41e4649b934ca495991b7852b855",
      "size_bytes": 0
    },
    {
      "media_type": "application/json",
      "path": "input/instance.json",
      "sha256": "f90cd72a4cfc0d6177d9ae260f55c9593086a9f25031e96bd7d6a03eb11260cd",
      "size_bytes": 2636
    },
    {
      "media_type": "application/json",
      "path": "input_ref.json",
      "sha256": "955c804fee1152009aa130852aaaf08b6cf3a40d6a241534c19974e68779bf3a",
      "size_bytes": 619
    },
    {
      "media_type": "application/json",
      "path": "request.json",
      "sha256": "6e7f0789c7ad9a026a048416384190eea3dfa90de420c1d7e738550ee03c92a9",
      "size_bytes": 1816
    },
    {
      "media_type": "application/json",
      "path": "result/result.json",
      "sha256": "3bc1df14df64c6cd00db34b2e9f08b513c84982e6fa670d8891e5aacf4e9a48f",
      "size_bytes": 526
    },
    {
      "media_type": "application/json",
      "path": "verification/verification.json",
      "sha256": "660321e979a58ff67c02749ddad8919e6c7036716e35392584d543d8ca51c1ad",
      "size_bytes": 546
    }
  ],
  "backend_details": {
    "backend_detection": {
      "actual": "branch-and-bound",
      "requested": "auto",
      "selected": "branch-and-bound"
    },
    "backend_version": "unknown",
    "capabilities": {},
    "native": false
  },
  "configuration_sha256": "c9a05af4ed0f9e25f167192f764407067f494d55ef883778ea4f73534b3854b2",
  "experiment_id": "kdc-smoke20-all-registered-final-20261012T074200",
  "family": "sbgdb-20200507-fpg-poly",
  "finished_at": "2026-10-12T04:29:26.917429Z",
  "input_sha256": "f90cd72a4cfc0d6177d9ae260f55c9593086a9f25031e96bd7d6a03eb11260cd",
  "instance_id": "sbgdb-20200507-fpg-poly_0000000030-7493750b7865-f90cd72a4c",
  "m": 25,
  "n": 1,
  "objective": "minmax",
  "provenance": {
    "platform": "macOS-27.2-arm64-arm-64bit",
    "solver_version": "unknown",
    "source_commit": null
  },
  "repeat": 0,
  "requested_backend": "auto",
  "rerun_of": "run_20261012T042127Z__ip-kont__minmax__sbgdb-20200507-fpg-poly_0000000030-749__r00__28328b10c62a",
  "resolved_configuration": {
    "actual_threads": 1,
    "actual_time_limit_sec": 10.0,
    "algorithm_category": "exact_candidate",
    "backend_capabilities": {},
    "backend_detection": {
      "actual": "branch-and-bound",
      "requested": "auto",
      "selected": "branch-and-bound"
    },
    "benchmark_profile": "DEBUG",
    "brute_force_max_assignments": 100000,
    "brute_force_time_limit_sec": 0.5,
    "dataset_profile": "smoke20",
    "diagnostic_max_assignments": null,
    "exact_time_limit_sec": 10.0,
    "execution_disposition": {
      "message": "ip-kont is registered but the native KONT/COPT backend is unavailable",
      "reason_code": "BACKEND_UNAVAILABLE",
      "status": "SKIPPED"
    },
    "experiment_label": "smoke / development validation",
    "fast_time_limit_sec": 5.0,
    "minmax_budget_fraction": 0.5,
    "minsum_budget_fraction": 0.5,
    "minsum_refinement_policy": "adaptive",
    "per_static_time_limit_sec": 2.0,
    "reference_designated": false,
    "requested_algorithm": "ip-kont",
    "requested_backend": "auto",
    "requested_threads": 2,
    "requested_time_limit_sec": 10.0,
    "resolved_algorithm": "ip-kont",
    "selected_backend": "branch-and-bound"
  },
  "result": {
    "error_message": "{\"message\": \"ip-kont is registered but the native KONT/COPT backend is unavailable\", \"reason_code\": \"BACKEND_UNAVAILABLE\", \"status\": \"SKIPPED\"}",
    "feasible": false,
    "lower_bound": null,
    "objective_value": null,
    "optimality_status": "FAILED",
    "solver_result": {},
    "upper_bound": null
  },
  "run_id": "run_20261012T042926Z__ip-kont__minmax__sbgdb-20200507-fpg-poly_0000000030-749__r00__265aedbf5052",
  "run_key": "46195ccddf02281833bb85a0c4957a9ef461d89fa91d83c7b03ab72d6cb522ca",
  "schema_version": 1,
  "seed": 42,
  "selected_backend": "branch-and-bound",
  "started_at": "2026-10-12T04:29:26.912327Z",
  "status": "SKIPPED",
  "verification": {
    "checked_at": "2026-10-12T04:29:26.914951Z",
    "continuous": false,
    "experiment_id": "kdc-smoke20-all-registered-final-20261012T074200",
    "kind": "NONE",
    "message": "ip-kont is registered but the native KONT/COPT backend is unavailable",
    "passed": false,
    "result_sha256": "3bc1df14df64c6cd00db34b2e9f08b513c84982e6fa670d8891e5aacf4e9a48f",
    "run_id": "run_20261012T042926Z__ip-kont__minmax__sbgdb-20200507-fpg-poly_0000000030-749__r00__265aedbf5052",
    "schema_version": 1,
    "status": "NOT_RUN",
    "verification_mode": "not-run"
  }
}
